status,copyright,response.docs.abstract,response.docs.web_url,response.docs.snippet,response.docs.lead_paragraph,response.docs.source,response.docs.pub_date,response.docs.document_type,response.docs.news_desk,response.docs.section_name,response.docs.subsection_name,response.docs.type_of_material,response.docs._id,response.docs.word_count,response.docs.uri,response.docs.slideshow_credits,response.docs.headline.main,response.docs.headline.kicker,response.docs.headline.content_kicker,response.docs.headline.print_headline,response.docs.headline.name,response.docs.headline.seo,response.docs.headline.sub,response.docs.byline.original,response.docs.byline.organization,response.meta.hits,response.meta.offset,response.meta.time,response.docs.print_section,response.docs.print_page
OK,Copyright (c) 2020 The New York Times Company. All Rights Reserved.,"Investors pulled a record amount of money from Pimco’s flagship Total Return bond fund in June, a stark indication of how rising interest rates have pushed bonds out of favor.",https://dealbook.nytimes.com/2013/07/02/investors-pull-9-6-billion-from-pimco-fund/,"Investors pulled a record amount of money from Pimco’s flagship Total Return bond fund in June, a stark indication of how rising interest rates have pushed bonds out of favor.","Investors pulled a record amount of money from Pimco’s flagship Total Return bond fund in June, a stark indication of how rising interest rates have pushed bonds out of favor. ",The New York Times,2013-07-02T21:23:40+0000,article,,Business Day,NA,News,nyt://article/fb295149-6ee9-5884-8b72-8891f74e2b7c,291,nyt://article/fb295149-6ee9-5884-8b72-8891f74e2b7c,NA,Investors Pull $9.6 Billion From Pimco Fund,DealBook,NA,Investors Check Out,NA,NA,NA,By Nathaniel Popper,NA,518,120,26,B,5
OK,Copyright (c) 2020 The New York Times Company. All Rights Reserved.,Will the woman Forbes is calling “the most dominant golfer in the world” get proper recognition?,https://takingnote.blogs.nytimes.com/2013/07/01/inbee-parks-winning-streak/,Will the woman Forbes is calling “the most dominant golfer in the world” get proper recognition?,"The South Korean golfer Inbee Park on Sunday won her third straight major tournament, the U.S. Women’s Open at Sebonack Golf Club in Southampton, N.Y. — a streak no other female golfer has managed since Babe Didrikson Zaharias in 1950.",The New York Times,2013-07-01T18:10:32+0000,article,,Opinion,NA,News,nyt://article/f68232bb-2157-5594-9b92-2340dd022377,180,nyt://article/f68232bb-2157-5594-9b92-2340dd022377,NA,Inbee Park’s Winning Streak,Taking Note,NA,NA,NA,NA,NA,By Lawrence Downes,NA,518,120,26,NA,NA
OK,Copyright (c) 2020 The New York Times Company. All Rights Reserved.,Scenes from the couture fashion week photo diary of Barbara Anastacio.,https://tmagazine.blogs.nytimes.com/2013/07/02/the-scene-paris-couture-fashion-week-iris-van-herpen/,Scenes from the couture fashion week photo diary of Barbara Anastacio.,Scenes from the couture fashion week photo diary of Barbara Anastacio.,The New York Times,2013-07-02T15:39:05+0000,article,TStyle,T Magazine,NA,News,nyt://article/5d95a368-45ea-53b2-8c55-2c430090c2f0,16,nyt://article/5d95a368-45ea-53b2-8c55-2c430090c2f0,NA,Paris Couture Fashion Week: Iris van Herpen Fall 2013,T Magazine,NA,NA,NA,NA,NA,By Barbara Anastacio,NA,518,120,26,NA,NA
OK,Copyright (c) 2020 The New York Times Company. All Rights Reserved.,I feared being the child identified chiefly by her misfortune.,https://opinionator.blogs.nytimes.com/2013/07/01/poor-little-motherless-child/,I feared being the child identified chiefly by her misfortune.,"When our mother was dying, my little brother would imagine that it was all happening in a play. Our parents worked in the London theater, and we spent many hours there in the darkness, adrift in musicals and comedies, with the light and drama telling us the only story that mattered at the time. So it seemed almost plausible to him — perhaps the terror in our own life was not real life after all. Perhaps it was simply theater.",The New York Times,2013-07-01T11:00:12+0000,article,,Opinion,NA,News,nyt://article/a6ef50ad-88b2-5c68-be52-8583b20d6105,1184,nyt://article/a6ef50ad-88b2-5c68-be52-8583b20d6105,NA,"Poor, Little Motherless Child",Anxiety,NA,NA,NA,NA,NA,By Caroline H. Dworin,NA,518,130,38,NA,NA
OK,Copyright (c) 2020 The New York Times Company. All Rights Reserved.,The AirRam from Gtech combines the simplicity of a cordless vacuum with the power of an electrical vacuum.,https://gadgetwise.blogs.nytimes.com/2013/07/02/an-innovative-design-for-nabbing-dust-bunnies/,The AirRam from Gtech combines the simplicity of a cordless vacuum with the power of an electrical vacuum.,"Gtech, a maker of floor-care and garden products in Britain, is setting its sights on the United States with the introduction here of its latest vacuum, the AirRam.",The New York Times,2013-07-02T13:05:41+0000,article,,Technology,Personal Tech,News,nyt://article/1410073a-bae8-5845-8dcc-4c871c90c6df,398,nyt://article/1410073a-bae8-5845-8dcc-4c871c90c6df,NA,An Innovative Design for Nabbing Dust Bunnies,Gadgetwise,NA,"Cleaner, Powered (Loudly) by a Lithium-Ion Battery",NA,NA,NA,By Gregory Schmidt,NA,518,130,38,B,8
OK,Copyright (c) 2020 The New York Times Company. All Rights Reserved.,"The Tribune Company agreed on Monday to buy 19 local television stations for about $2.7 billion, becoming one of the nation’s biggest owners of commercial TV stations as part of an effort to build out its video and digital operations and move away from newspapers.",https://dealbook.nytimes.com/2013/07/01/tribune-to-buy-19-tv-stations-for-2-7-billion/,"The Tribune Company agreed on Monday to buy 19 local television stations for about $2.7 billion, becoming one of the nation’s biggest owners of commercial TV stations as part of an effort to build out its video and digital operations and move away...",8:36 p.m. | Updated ,The New York Times,2013-07-01T11:36:35+0000,article,,Business Day,NA,News,nyt://article/0fcf0bfc-b9d2-5ee7-8bde-2f51099d464e,1089,nyt://article/0fcf0bfc-b9d2-5ee7-8bde-2f51099d464e,NA,Tribune in $2.7 Billion Deal for 19 Local TV Stations,DealBook,NA,Tribune in $2.7 Billion Deal for 19 Local TV Stations,NA,NA,NA,By Brian Stelter and Christine Haughney,NA,518,130,38,B,1
OK,Copyright (c) 2020 The New York Times Company. All Rights Reserved.,"An award-winning series on burlesque dancers in Israel brought Dan Balilty into their homes, where he noticed that many of them had dogs.",https://lens.blogs.nytimes.com/2013/07/02/man-photographs-dog/,"An award-winning series on burlesque dancers in Israel brought Dan Balilty into their homes, where he noticed that many of them had dogs.","Dan Balilty never photographed people looking as natural and beautiful as when they were with their dogs. If anything, he said, they became “better versions of themselves.”",The New York Times,2013-07-02T09:00:18+0000,article,,Multimedia/Photos,NA,News,nyt://article/bb0294c1-3856-5c72-bf9d-f3bd25a30d11,775,nyt://article/bb0294c1-3856-5c72-bf9d-f3bd25a30d11,NA,"Dog and Owner, Yin and Yang",Lens,NA,NA,NA,NA,NA,By Alyza Sebenius,NA,518,130,38,NA,NA
OK,Copyright (c) 2020 The New York Times Company. All Rights Reserved.,"The Islanders sent Nino Niederreiter to Minnesota for Cal Clutterbuck, and took defenseman Ryan Pulock with the 15th over all pick in Sunday’s N.H.L. draft.",https://slapshot.blogs.nytimes.com/2013/06/30/islanders-make-deal-with-wild-before-selecting-a-defenseman-in-the-first-round/,"The Islanders sent Nino Niederreiter to Minnesota for Cal Clutterbuck, and took defenseman Ryan Pulock with the 15th over all pick in Sunday’s N.H.L. draft.",10:11 p.m. | Updated NEWARK — The Islanders were busy early on Sunday at the N.H.L draft at the Prudential Center. ,The New York Times,2013-07-01T00:52:06+0000,article,,Sports,Hockey,News,nyt://article/85f4daf2-208e-5785-a2cd-bab53c8494b1,532,nyt://article/85f4daf2-208e-5785-a2cd-bab53c8494b1,NA,Islanders Make Deal With Wild Before Selecting a Defenseman in the First Round,Slap Shot,NA,NA,NA,NA,NA,By Allan Kreda,NA,518,130,38,NA,NA
OK,Copyright (c) 2020 The New York Times Company. All Rights Reserved.,"A conversation with a Russian MP, an insight into an altered reality.",https://latitude.blogs.nytimes.com/2013/07/01/my-dinner-with-valery/,"A conversation with a Russian MP, an insight into an altered reality.","MOSCOW — Each table at this birthday dinner had a name. My girlfriend and I were to be seated at “Progressives 1.” When we took our seats, a right-liberal political analyst and a right-liberal political consultant and their two wives were there, and two chairs were still empty.",The New York Times,2013-07-01T14:50:35+0000,article,,Opinion,NA,News,nyt://article/c31c7f41-2cb7-5cb5-90c7-e52994c4c5f8,1009,nyt://article/c31c7f41-2cb7-5cb5-90c7-e52994c4c5f8,NA,My Dinner With Valery,Latitude,NA,NA,NA,NA,NA,By Masha Gessen,NA,518,130,38,NA,NA
OK,Copyright (c) 2020 The New York Times Company. All Rights Reserved.,A weekly capsule of travel news curated by our writers and editors.,https://intransit.blogs.nytimes.com/2013/07/01/walkabout-71-trans-atlantic-flights-for-10-and-interactive-hotel-tvs/,A weekly capsule of travel news curated by our writers and editors.,"Across the Atlantic for $10? Michael O’Leary, above, the chief executive of Ryanair who has suggested ideas like standing cabins and pay toilets, has a new concept: Europe to U.S. flights for $10. (Bloomberg)",The New York Times,2013-07-01T17:43:00+0000,article,,Travel,NA,News,nyt://article/fe2f0ec3-245d-5ff9-b000-b7702db8b508,162,nyt://article/fe2f0ec3-245d-5ff9-b000-b7702db8b508,NA,Walkabout – 7/1: Trans-Atlantic Flights for $10 and Interactive Hotel TVs,In Transit,NA,NA,NA,NA,NA,By The New York Times,The New York Times,518,130,38,NA,NA
OK,Copyright (c) 2020 The New York Times Company. All Rights Reserved.,"In an advertisement promoting Motorola Mobility’s new smartphone, it borrows familiar themes from Apple, including the emphasis that it is made in America.",https://bits.blogs.nytimes.com/2013/07/02/motorola-apple-made-in-america/,"In an advertisement promoting Motorola Mobility’s new smartphone, it borrows familiar themes from Apple, including the emphasis that it is made in America.","On the day before Independence Day, Motorola Mobility, the handset maker owned by Google, will be running a new advertisement in newspapers for its next smartphone. The ad, however, won’t show a phone. It’s all about how the handset will be made in America.",The New York Times,2013-07-02T22:33:59+0000,article,,Technology,NA,News,nyt://article/6a5f5700-c7f5-53cf-b5f6-703173deb3ce,207,nyt://article/6a5f5700-c7f5-53cf-b5f6-703173deb3ce,NA,Motorola Ad Seems to Catch the ‘Made in U.S.A.’ Bug From Apple,Bits,NA,NA,NA,NA,NA,By Brian X. Chen,NA,518,130,38,NA,NA
OK,Copyright (c) 2020 The New York Times Company. All Rights Reserved.,Tweaking a classic while fresh green peas are in season.,https://dinersjournal.blogs.nytimes.com/2013/07/02/green-pea-guacamole/,Tweaking a classic while fresh green peas are in season.,"The Restaurant Takeaway column is devoted to restaurant dishes you can make in your own kitchen, tweaked for home cooks. Visit Cooking for more guacamole recipes.I’d always thought that when it comes to excellent guacamole, less is more, and that the best versions of the dip are always the most basic. Then I tried the green pea guacamole at ABC Cocina, and I changed my mind.",The New York Times,2013-07-02T15:00:47+0000,article,,Style,NA,News,nyt://article/c4f6752a-548b-58ac-937d-027e3ab9657c,461,nyt://article/c4f6752a-548b-58ac-937d-027e3ab9657c,NA,Green Pea Guacamole,Diner&#039;s Journal,NA,NA,NA,NA,NA,By Melissa Clark,NA,518,130,38,NA,NA
OK,Copyright (c) 2020 The New York Times Company. All Rights Reserved.,"John C. Malone of Liberty Media is said to be weighing a deal for Time Warner Cable. | Criminal defense work, once shunned by top law firms, is looking increasingly lucrative. | Onyx Pharmaceuticals put itself up for sale after rejecting an unsolicited $10 billion takeover bid. | An updated analysis shows C.E.O.’s got a large raise last year.",https://dealbook.nytimes.com/2013/07/01/deal-talk-in-cable-tv/,"John C. Malone of Liberty Media is said to be weighing a deal for Time Warner Cable. | Criminal defense work, once shunned by top law firms, is looking increasingly lucrative. | Onyx Pharmaceuticals put itself up for sale after rejecting an unsoli...","John C. Malone, chairman of Liberty Media, who made his name through shrewd deal-making in the telecommunications industry, “is weighing a deal for Time Warner Cable, according to people briefed on the matter who were not authorized to speak publicly,” Michael J. de la Merced and Brian Stelter report in DealBook. “In this deal, Charter Communications, a cable operator in which Liberty owns a 27 percent stake, would buy Time Warner Cable. Should he reach a deal, he will most likely use the combined company to roll up other cable operators, upending a status quo dominated by giants like Comcast.”",The New York Times,2013-07-01T12:16:16+0000,article,,Business Day,NA,News,nyt://article/d3b88f69-12de-535b-80ca-b587c04b25aa,1822,nyt://article/d3b88f69-12de-535b-80ca-b587c04b25aa,NA,Deal Talk in Cable TV,DealBook,NA,NA,NA,NA,NA,By William Alden,NA,518,130,38,NA,NA
OK,Copyright (c) 2020 The New York Times Company. All Rights Reserved.,"Photos from Egypt, South Africa, Afghanistan and Kashmir.",https://lens.blogs.nytimes.com/2013/07/02/pictures-of-the-day-egypt-and-elsewhere-55/,"Photos from Egypt, South Africa, Afghanistan and Kashmir.","Photos from Egypt, South Africa, Afghanistan and Kashmir.",The New York Times,2013-07-02T20:37:37+0000,article,,Multimedia/Photos,NA,News,nyt://article/d26f30d6-a69a-50e8-938d-767099b7ed7a,13,nyt://article/d26f30d6-a69a-50e8-938d-767099b7ed7a,NA,Pictures of the Day: Egypt and Elsewhere,Lens,NA,NA,NA,NA,NA,By The New York Times,The New York Times,518,140,84,NA,NA
OK,Copyright (c) 2020 The New York Times Company. All Rights Reserved.,"Apple, typically, is being secretive about its intentions, and may — or may not — be developing a watch that does more than tell time.",https://bits.blogs.nytimes.com/2013/07/02/apples-trademark-of-iwatch-fuels-speculation/,"Apple, typically, is being secretive about its intentions, and may — or may not — be developing a watch that does more than tell time.","Apple has moved to register “iWatch” as a trademark in several countries, fueling speculation that the company is working on a gadget worn on the wrist that does a lot more than keep the time.",The New York Times,2013-07-02T17:50:02+0000,article,,Technology,NA,News,nyt://article/12b2d984-0997-5c38-bd73-13e107d7e4c2,658,nyt://article/12b2d984-0997-5c38-bd73-13e107d7e4c2,NA,Apple’s Trademark of ‘iWatch’ Fuels Speculation,Bits,NA,NA,NA,NA,NA,By Eric Pfanner,NA,518,140,84,NA,NA
OK,Copyright (c) 2020 The New York Times Company. All Rights Reserved.,"China’s leadership appears to have decided to focus on the quality rather than the quantity of economic growth, the author contends.",https://dealbook.nytimes.com/2013/07/01/urban-smog-and-hazy-economic-prospects-in-china/,"China’s leadership appears to have decided to focus on the quality rather than the quantity of economic growth, the author contends.",Beijing has been hot and smoggy for the last few days. The pollution was so bad that over the weekend the authorities advised residents to stay indoors. The near-term prospects for China’s economy appear at least as hazy.,The New York Times,2013-07-01T17:26:36+0000,article,,Business Day,NA,News,nyt://article/90e12c69-3eac-5820-a5f5-0b8b6ddb223c,1088,nyt://article/90e12c69-3eac-5820-a5f5-0b8b6ddb223c,NA,Urban Smog and Hazy Economic Prospects in China,DealBook,NA,NA,NA,NA,NA,By Bill Bishop,NA,518,140,84,NA,NA
OK,Copyright (c) 2020 The New York Times Company. All Rights Reserved.,So-called metadata about cellphone calls can provide all sorts of information about the owner to law enforcement. But legislators in several states are considering laws that require the police to get a warrant to obtain that data.,https://bits.blogs.nytimes.com/2013/07/02/with-montanas-lead-states-may-demand-warrants-for-cellphone-data/,So-called metadata about cellphone calls can provide all sorts of information about the owner to law enforcement. But legislators in several states are considering laws that require the police to get a warrant to obtain that data.,The law rarely keeps up with technological advances – except in Montana. ,The New York Times,2013-07-02T21:24:13+0000,article,,Technology,NA,News,nyt://article/86100364-8550-53be-b222-3677b66976b3,453,nyt://article/86100364-8550-53be-b222-3677b66976b3,NA,"With Montana’s Lead, States May Demand Warrants for Cellphone Data",Bits,NA,"Montana Curbs
Location-Tracking
By the Police",NA,NA,NA,By Somini Sengupta,NA,518,140,84,B,5
OK,Copyright (c) 2020 The New York Times Company. All Rights Reserved.,"Toronto’s effort to create a livable city through densely populated neighborhoods is a roaring success, but to what end?",https://www.nytimes.com/2013/07/03/business/a-soaring-condo-market-in-toronto-ignites-fears-of-a-crash.html,"Toronto’s effort to create a livable city through densely populated neighborhoods is a roaring success, but to what end?","TORONTO — Sandwiched between two rail lines in this city’s core, great factories once produced the finest Canada could offer the world: Magic baking powder, Brunswick bowling alley flooring and Massey Ferguson farm equipment.",The New York Times,2013-07-02T16:26:32+0000,article,Business,Business Day,NA,News,nyt://article/f7884749-a39c-5961-ba52-01de72f5b640,1016,nyt://article/f7884749-a39c-5961-ba52-01de72f5b640,NA,A Dizzying Condo Market in Toronto,NA,NA,A Dizzying Condo Market,NA,NA,NA,By Ian Austen,NA,518,140,84,B,1
OK,Copyright (c) 2020 The New York Times Company. All Rights Reserved.,"That most prosaic of public furnishings, the New York City park bench has morphed into a blank canvas on which designers, landscape architects and artists have unleashed their fantasies.",https://www.nytimes.com/2013/07/02/nyregion/with-new-park-benches-designers-find-room-to-stretch-their-imaginations.html,"That most prosaic of public furnishings, the New York City park bench has morphed into a blank canvas on which designers, landscape architects and artists have unleashed their fantasies.","There are wooden chaises roomy enough for two. Bar-stool-style perches with river views. Communal work stations for laptop users. Huge granite slabs. Even hammocks. That most prosaic of public furnishings, the New York City park bench, has morphed into a blank canvas on which designers, landscape architects and artists have unleashed their fantasies.",The New York Times,2013-07-01T23:23:29+0000,article,Metro,New York,NA,News,nyt://article/ad36fa5c-de62-5617-b754-f79b9ee78998,627,nyt://article/ad36fa5c-de62-5617-b754-f79b9ee78998,NA,Designers Stretch Out Imaginations on Park Benches,NA,NA,Designers Stretch Out Imaginations On Benches,NA,NA,NA,By Lisa W. Foderaro,NA,518,140,84,A,17
OK,Copyright (c) 2020 The New York Times Company. All Rights Reserved.,Scientists said the deadly Arizona blaze and 15 others that remained uncontained from New Mexico to California were part of a warmer trend in the West that would bring more catastrophic fires.,https://www.nytimes.com/2013/07/02/us/experts-see-a-hotter-drier-west-with-more-huge-fires.html,Scientists said the deadly Arizona blaze and 15 others that remained uncontained from New Mexico to California were part of a warmer trend in the West that would bring more catastrophic fires.,"One of the deadliest wildfires in a generation vastly expanded Monday to cover more than 8,000 acres, sweeping up sharp slopes through dry scrub and gnarled piñon pines a day after fickle winds and flames killed 19 firefighters.",The New York Times,2013-07-02T01:13:55+0000,article,National,U.S.,NA,News,nyt://article/7e974b9f-de08-573c-9652-f03cbccf595f,1058,nyt://article/7e974b9f-de08-573c-9652-f03cbccf595f,NA,"Experts See New Normal as a Hotter, Drier West Faces More Huge Fires",NA,NA,"Experts See New Normal As a Hotter, Drier West Faces More Huge Fires",NA,NA,NA,By Felicity Barringer and Kenneth Chang,NA,518,140,84,A,13
OK,Copyright (c) 2020 The New York Times Company. All Rights Reserved.,"At the trial of James (Whitey) Bulger, the wife of a murder victim thanked the lawyer for cross-examination that led to an apology to her family from a former F.B.I. supervisor.",https://www.nytimes.com/2013/07/02/us/in-twist-bulgers-lawyer-gets-words-of-gratitude-from-victims-wife.html,"At the trial of James (Whitey) Bulger, the wife of a murder victim thanked the lawyer for cross-examination that led to an apology to her family from a former F.B.I. supervisor.","BOSTON — At the midmorning break in the trial of James (Whitey) Bulger, Patricia Donahue had a few choice words for Henry Brennan, one of the lawyers defending the crime boss against a sweeping slate of charges that include participation in the murder of her husband, Michael Donahue. She and her family approached him, and thanked him.",The New York Times,2013-07-02T01:02:52+0000,article,National,U.S.,NA,News,nyt://article/3eff28d1-f932-5597-a1e8-37b1aff07e70,716,nyt://article/3eff28d1-f932-5597-a1e8-37b1aff07e70,NA,"In Twist, Bulger’s Lawyer Gets Words of Gratitude From Victim’s Wife",NA,NA,"In Twist, Victim’s Wife Is Grateful to Bulger’s Lawyer",NA,NA,NA,By Jess Bidgood,NA,518,140,84,A,15
OK,Copyright (c) 2020 The New York Times Company. All Rights Reserved.,"As Mayor Michael R. Bloomberg’s term nears its end, New York arts organizations are worried about life without a rich leader who can privately fatten their budgets.",https://www.nytimes.com/2013/07/02/arts/art-world-fears-losing-a-mayor-and-his-money.html,"As Mayor Michael R. Bloomberg’s term nears its end, New York arts organizations are worried about life without a rich leader who can privately fatten their budgets.",He has helped stage audacious outdoor art exhibitions and supported cultural groups through expansions and renovations — while quietly contributing hundreds of millions of dollars from his own personal fortune. ,The New York Times,2013-07-02T03:48:39+0000,article,Culture,Arts,NA,News,nyt://article/5c9aceca-65c4-57c1-be3d-f259e6c5e291,1608,nyt://article/5c9aceca-65c4-57c1-be3d-f259e6c5e291,NA,"Art Groups Fear Losing a Mayor, and His Money",NA,NA,"Art World Fears Losing a Mayor, And His Money",NA,NA,NA,By Robin Pogrebin and Michael M. Grynbaum,NA,518,140,84,A,1
OK,Copyright (c) 2020 The New York Times Company. All Rights Reserved.,"It was Sabine Lisicki’s turn to make tennis fans say, “Who?” by eliminating Serena Williams, who was fresh off dominating the French Open and had a 34-match winning streak.",https://www.nytimes.com/2013/07/02/sports/tennis/a-wimbledon-of-falling-stars-and-teardrops.html,"It was Sabine Lisicki’s turn to make tennis fans say, “Who?” by eliminating Serena Williams, who was fresh off dominating the French Open and had a 34-match winning streak.","WIMBLEDON, England — Sabine Lisicki, a 23-year-old German, got up from lying on the Centre Court grass and said, “I’m so happy.” Then she broke into tears.",The New York Times,2013-07-02T00:52:25+0000,article,Sports,Sports,Tennis,News,nyt://article/8d91c321-fdc7-59a8-981e-c62c05bfee99,1146,nyt://article/8d91c321-fdc7-59a8-981e-c62c05bfee99,NA,A Wimbledon of Falling Stars and Teardrops,NA,NA,One More Upset at a Tournament Full of Them,NA,NA,NA,By Naila-Jean Meyers,NA,518,140,84,B,15
OK,Copyright (c) 2020 The New York Times Company. All Rights Reserved.,"The former security contractor denounced President Obama, accusing him of blocking his efforts to seek asylum.",https://www.nytimes.com/2013/07/02/world/europe/snowden-speaks-out-in-moscow-for-first-time.html,"The former security contractor denounced President Obama, accusing him of blocking his efforts to seek asylum.","Edward J. Snowden, the fugitive former American security contractor, appeared to break his silence on Monday for the first time since he flew to Moscow eight days earlier. WikiLeaks, the anti-secrecy group, issued a statement attributed to him that denounced President Obama for revoking his passport, opposing his asylum requests and leaving him a “stateless person.”",The New York Times,2013-07-01T23:08:53+0000,article,Foreign,World,Europe,News,nyt://article/100ac45e-08a3-5a07-b98a-d79e923ac005,655,nyt://article/100ac45e-08a3-5a07-b98a-d79e923ac005,NA,Snowden Is Said to Claim U.S. Is Blocking Asylum Bids,NA,NA,Leaker Is Said To Claim U.S. Is Blocking Asylum Bids,NA,NA,NA,By Rick Gladstone and William Neuman,NA,518,150,49,A,6
OK,Copyright (c) 2020 The New York Times Company. All Rights Reserved.,"It may be a disaster zone, but it’s our disaster zone.",https://www.nytimes.com/2013/07/02/opinion/living-with-fire.html,"It may be a disaster zone, but it’s our disaster zone.","PRESCOTT, Ariz. — WHEN you build a fire in a fireplace, you start with paper, add kindling, and finally arrange the larger logs on top. That perfectly describes the summertime environment in the southwestern mountains of the United States.",The New York Times,2013-07-02T01:02:08+0000,article,OpEd,Opinion,NA,Op-Ed,nyt://article/3361a242-eba2-508e-8b46-f55455b544b5,849,nyt://article/3361a242-eba2-508e-8b46-f55455b544b5,NA,Living With Fire,Op-Ed Contributor,NA,Living With Fire,NA,NA,NA,By Alan Dean Foster,NA,518,150,49,A,25
