status,copyright,response.docs.abstract,response.docs.web_url,response.docs.snippet,response.docs.lead_paragraph,response.docs.source,response.docs.pub_date,response.docs.document_type,response.docs.news_desk,response.docs.section_name,response.docs.subsection_name,response.docs.type_of_material,response.docs._id,response.docs.word_count,response.docs.uri,response.docs.slideshow_credits,response.docs.headline.main,response.docs.headline.kicker,response.docs.headline.content_kicker,response.docs.headline.print_headline,response.docs.headline.name,response.docs.headline.seo,response.docs.headline.sub,response.docs.byline.original,response.docs.byline.organization,response.meta.hits,response.meta.offset,response.meta.time,response.docs.print_section,response.docs.print_page
OK,Copyright (c) 2020 The New York Times Company. All Rights Reserved.,Leslie Uggams is among those returning to roles they played on stage.,https://artsbeat.blogs.nytimes.com/2013/07/01/actors-and-directors-for-readings-of-august-wilson-cycle-are-veterans-of-playwrights-work/,Leslie Uggams is among those returning to roles they played on stage.,"Phylicia Rashad, Ruben Santiago-Hudson, Kenny Leon and Leslie Uggams are among the actors and directors coming together for staged dramatic readings of 10 August Wilson plays, the project directors announced on Monday. Others include S. Epatha Merkerson, Taraji P. Henson, Marion McClinton, Stephen McKinley Henderson, Wendell Pierce and Jesse L. Martin. Tickets went on sale Monday for the performances, which will begin Aug. 26 with “Ma Rainey’s Black Bottom.” The readings, before studio audiences at New York Public Radio’s Jerome L. Greene Space in New York, are to be recorded for New York Public Radio archives.",The New York Times,2013-07-01T16:48:33+0000,article,,Arts,NA,News,nyt://article/8c0d541a-8e56-5a81-a8cb-dc373d6109e3,457,nyt://article/8c0d541a-8e56-5a81-a8cb-dc373d6109e3,NA,Actors and Directors for Readings of August Wilson Cycle Are Veterans of Playwright’s Work,ArtsBeat,NA,NA,NA,NA,NA,By Felicia R. Lee,NA,518,250,31,NA,NA
OK,Copyright (c) 2020 The New York Times Company. All Rights Reserved.,Can you crack this camel challenge from the 2012 Dutch Mathematical Olympiad?,https://wordplay.blogs.nytimes.com/2013/07/01/amsterdam/,Can you crack this camel challenge from the 2012 Dutch Mathematical Olympiad?,"Last week’s Odd Dice was one of the easier puzzles we’ve featured on Numberplay. It was meant to be that way — the challenge was offered to introduce the Dutch Mathematical Olympiad, an annual competition open to all high school students in the Netherlands. Last week’s puzzle was from Round One of the 2009 event; this week we move onto the Tweede Ronde of the competition with a camel distribution problem and a verbal arithmetic bonus from 2012.",The New York Times,2013-07-01T16:00:10+0000,article,,Crosswords & Games,NA,News,nyt://article/8d90ae94-6a33-5cb7-b8d2-ad9dea8a6451,534,nyt://article/8d90ae94-6a33-5cb7-b8d2-ad9dea8a6451,NA,Camels in Amsterdam,Wordplay,NA,NA,NA,NA,NA,By Gary Antonick,NA,518,250,31,NA,NA
OK,Copyright (c) 2020 The New York Times Company. All Rights Reserved.,"Two backers of the alternative crypto-currency bitcoin, Cameron and Tyler Winklevoss, the twins best known for their part in the history of Facebook, are trying to bring bitcoin to a broader investing public, pending approval of the United States government, Nathaniel Popper and Peter Lattman report in DealBook.",https://dealbook.nytimes.com/2013/07/02/bringing-bitcoin-to-the-mainstream/,,"Two backers of the alternative crypto-currency bitcoin, Cameron and Tyler Winklevoss, the twins best known for their part in the history of Facebook, are trying to bring bitcoin to a broader investing public, pending approval of the United States government, Nathaniel Popper and Peter Lattman report in DealBook.",The New York Times,2013-07-02T12:13:30+0000,article,,Business Day,NA,News,nyt://article/693175db-c39c-5636-807a-979430f38afa,1769,nyt://article/693175db-c39c-5636-807a-979430f38afa,NA,Bringing Bitcoin to the Mainstream,DealBook,NA,NA,NA,NA,NA,By William Alden,NA,518,250,31,NA,NA
OK,Copyright (c) 2020 The New York Times Company. All Rights Reserved.,A selection of events for this week.,https://dinersjournal.blogs.nytimes.com/2013/07/01/dining-calendar-24/,A selection of events for this week.,"During Italian Dine-Out, an Italian restaurant week of sorts, 23 Italian restaurants across the city will offer discounted lunch and dinner menus. Most of the restaurants have online reservations available for the Italian Trade Commission-sponsored promotion, which runs through Saturday.",The New York Times,2013-07-01T16:48:58+0000,article,,Style,NA,News,nyt://article/343ecdf3-913a-5680-9d1e-4de7ac0534a7,259,nyt://article/343ecdf3-913a-5680-9d1e-4de7ac0534a7,NA,Dining Calendar,Diner&#039;s Journal,NA,NA,NA,NA,NA,By Bao Ong,NA,518,250,31,NA,NA
OK,Copyright (c) 2020 The New York Times Company. All Rights Reserved.,"Writing about the polarizing new Kanye West album, Lou Reed says it contains “moments of supreme beauty and greatness.”",https://artsbeat.blogs.nytimes.com/2013/07/02/lou-reed-reviews-kanye-wests-yeezus-and-he-likes-it/,"Writing about the polarizing new Kanye West album, Lou Reed says it contains “moments of supreme beauty and greatness.”","Like him or not, Lou Reed is a man who certainly lets you know what he doesn’t like (and there are a great many things that he doesn’t). So is it surprising, or not surprising at all, that this rock ’n’ roll contrarian and front man of the Velvet Underground would turn out to be an enthusiastic fan of the Kanye West album “Yeezus,” one of the year’s most divisive pieces of music?",The New York Times,2013-07-02T16:05:28+0000,article,,Arts,NA,News,nyt://article/50b82aec-c9a6-5ba0-86a9-41646ace7c31,560,nyt://article/50b82aec-c9a6-5ba0-86a9-41646ace7c31,NA,"Lou Reed Reviews Kanye West’s ‘Yeezus,’ and He Likes It",ArtsBeat,NA,NA,NA,NA,NA,By Dave Itzkoff,NA,518,250,31,NA,NA
OK,Copyright (c) 2020 The New York Times Company. All Rights Reserved.,"With the 65th overall pick, the Rangers chose Adam Tambellini, a 6-foot-2 center whose father and brother each played for the Islanders.",https://slapshot.blogs.nytimes.com/2013/07/01/rangers-first-pick-is-one-with-ties-to-the-islanders/,"With the 65th overall pick, the Rangers chose Adam Tambellini, a 6-foot-2 center whose father and brother each played for the Islanders.","NEWARK — The Rangers did not make a selection until the third round of Sunday’s N.H.L. draft at the Prudential Center, and when they finally did, they chose somebody whose father and brother played for the Islanders.",The New York Times,2013-07-01T04:36:55+0000,article,,Sports,Hockey,News,nyt://article/a26ed062-72cc-5c82-a699-73ecc0a79f47,420,nyt://article/a26ed062-72cc-5c82-a699-73ecc0a79f47,NA,Rangers’ First Pick Is One With Ties to the Islanders,Slap Shot,NA,NA,NA,NA,NA,By Jeff Z. Klein,NA,518,250,31,NA,NA
OK,Copyright (c) 2020 The New York Times Company. All Rights Reserved.,Rosneft says it is buying the 49 percent of the Itera Oil and Gas Company that it does not already own for $2.9 billion in a bid to expand the company’s relatively modest natural gas operations.,https://dealbook.nytimes.com/2013/07/02/rosneft-takes-over-major-gas-producer-in-russia-in-2-9-billion-deal/,Rosneft says it is buying the 49 percent of the Itera Oil and Gas Company that it does not already own for $2.9 billion in a bid to expand the company’s relatively modest natural gas operations.,"Rosneft announced on Tuesday that it was buying the 49 percent of the Itera Oil and Gas Company that it did not already own for $2.9 billion. Rosneft is buying the stake from Itera Holdings Ltd., a natural resources company controlled by Igor Makarov.",The New York Times,2013-07-02T12:58:09+0000,article,,Business Day,NA,News,nyt://article/d06b8c29-bc20-5ac1-a9b1-b9526daacbf9,199,nyt://article/d06b8c29-bc20-5ac1-a9b1-b9526daacbf9,NA,Rosneft Takes Over Russian Gas Producer in $2.9 Billion Deal,DealBook,NA,Acquisition Spree,NA,NA,NA,By Stanley Reed,NA,518,260,26,B,5
OK,Copyright (c) 2020 The New York Times Company. All Rights Reserved.,"Rashtriya Swayamsevak Sangh, the mothership of India’s Hindu right, loses its ideological battle against Cricket.",https://india.blogs.nytimes.com/2013/07/02/why-does-the-rashtriya-swayemsewak-sangh-resent-cricket/,"Rashtriya Swayamsevak Sangh, the mothership of India’s Hindu right, loses its ideological battle against Cricket.","Nagpur, a city of nearly 2.5 million in central Indian state of Maharashtra, has the slow rhythms of a small town. The noise and edginess of the new Indian metropolis, the gargantuan   shopping malls and luxury automobiles, have yet to overwhelm it. Nagpur seeks half-hearted recognition as India’s Orange City, for being a major trade center for oranges cultivated in the region. Nagpur makes an appearance on the national stage when the right-wing guardians of the Rashtriya Swayamsevak Sangh (RSS), pronounce their views on Indian politics or society from their headquarters in the city.",The New York Times,2013-07-02T07:23:22+0000,article,,World,Asia Pacific,News,nyt://article/e1d90148-393a-5e65-8193-dab2453c3d8e,1588,nyt://article/e1d90148-393a-5e65-8193-dab2453c3d8e,NA,Why Does the Rashtriya Swayamsevak Sangh Resent Cricket?,India Ink,NA,NA,NA,NA,NA,By Vaibhav Vats,NA,518,260,26,NA,NA
OK,Copyright (c) 2020 The New York Times Company. All Rights Reserved.,"The Times reporter Henry Fountain takes a look at two vessels: one powered by solar energy, and one made of concrete.",https://www.nytimes.com/video/science/100000002308717/boat-of-light-boat-of-stone.html,"The Times reporter Henry Fountain takes a look at two vessels: one powered by solar energy, and one made of concrete.","The Times reporter Henry Fountain takes a look at two vessels: one powered by solar energy, and one made of concrete.",The New York Times,2013-07-01T16:48:25+0000,multimedia,Science,Science,NA,Video,nyt://video/37496b22-a157-5576-9554-cb17dce350a9,0,nyt://video/37496b22-a157-5576-9554-cb17dce350a9,NA,"Boat of Light, Boat of Stone",NA,NA,NA,NA,NA,NA,"Jeffery DelViscio, Pedro Rafael Rosado, David Corcoran, Kriston Lewis, Robin Lindsay and Abe Sater",NA,518,260,26,NA,NA
OK,Copyright (c) 2020 The New York Times Company. All Rights Reserved.,"After a four-year departure from couture, the designer Christian Lacroix returns with a collection for Schiaparelli.",https://www.nytimes.com/video/fashion/100000002315420/christian-lacroix-a-return-to-couture.html,"After a four-year departure from couture, the designer Christian Lacroix returns with a collection for Schiaparelli.","After a four-year departure from couture, the designer Christian Lacroix returns with a collection for Schiaparelli.",The New York Times,2013-07-02T14:36:53+0000,multimedia,,Fashion & Style,NA,Video,nyt://video/4d4d2af0-9bd1-5d98-aaa0-38867faa3dfb,0,nyt://video/4d4d2af0-9bd1-5d98-aaa0-38867faa3dfb,NA,Christian Lacroix: A Return to Couture,NA,NA,NA,NA,NA,NA,Stuart Everitt,NA,518,260,26,NA,NA
OK,Copyright (c) 2020 The New York Times Company. All Rights Reserved.,Money for the arts under Mayor Bloomberg.,https://www.nytimes.com/interactive/2013/07/02/arts/money-for-the-arts-under-bloomberg.html,Money for the arts under Mayor Bloomberg.,Money for the arts under Mayor Bloomberg.,The New York Times,2013-07-02T03:49:41+0000,multimedia,Arts,Arts,NA,Interactive Feature,nyt://interactive/ebd6f8b7-7bba-5d5f-be87-0013f510129b,0,nyt://interactive/ebd6f8b7-7bba-5d5f-be87-0013f510129b,NA,Money for the Arts Under Bloomberg,NA,NA,NA,NA,NA,NA,NA,NA,518,260,26,NA,NA
OK,Copyright (c) 2020 The New York Times Company. All Rights Reserved.,Scenes from the couture fashion week photo diary of Kasia Bobula.,https://json8.nytimes.com/slideshow/2013/06/30/t-magazine/paris-couture-fashion-week-versace.html,Scenes from the couture fashion week photo diary of Kasia Bobula.,Scenes from the couture fashion week photo diary of Kasia Bobula.,NA,2013-07-01T00:59:00+0000,multimedia,NA,NA,NA,Slideshow,nyt://slideshow/d4eef31d-5205-596a-a09a-217747131950,0,nyt://slideshow/d4eef31d-5205-596a-a09a-217747131950,NA,Paris Couture Fashion Week: Versace,NA,NA,NA,NA,NA,NA,By KASIA BOBULA,NA,518,260,26,NA,NA
OK,Copyright (c) 2020 The New York Times Company. All Rights Reserved.,Scenes from the couture fashion week photo diary of Barbara Anastacio.,https://json8.nytimes.com/slideshow/2013/07/02/t-magazine/paris-couture-fashion-week-iris-van-herpen.html,Scenes from the couture fashion week photo diary of Barbara Anastacio.,Scenes from the couture fashion week photo diary of Barbara Anastacio.,NA,2013-07-02T15:33:48+0000,multimedia,NA,NA,NA,Slideshow,nyt://slideshow/50411da5-96d9-58d3-bbbc-5be8f4db5ab3,0,nyt://slideshow/50411da5-96d9-58d3-bbbc-5be8f4db5ab3,NA,Paris Couture Fashion Week: Iris Van Herpen,NA,NA,NA,NA,NA,NA,By BARBARA ANASTACIO,NA,518,260,26,NA,NA
OK,Copyright (c) 2020 The New York Times Company. All Rights Reserved.,Inside the charming Thai restaurant on Spring Street.,https://www.nytimes.com/slideshow/2013/07/03/dining/20130703-REST.html,Inside the charming Thai restaurant on Spring Street.,Inside the charming Thai restaurant on Spring Street.,The New York Times,2013-07-02T20:47:06+0000,multimedia,Food,Food,NA,Slideshow,nyt://slideshow/684a1443-9e0f-5733-9cee-166821f60618,0,nyt://slideshow/684a1443-9e0f-5733-9cee-166821f60618,Benjamin Petit for The New York Times,Uncle Boons,NA,NA,NA,NA,NA,NA,NA,NA,518,260,26,NA,NA
OK,Copyright (c) 2020 The New York Times Company. All Rights Reserved.,Images from the actor’s film and television career.,https://www.nytimes.com/slideshow/2013/07/07/movies/20130707_CERA.html,Images from the actor’s film and television career.,Images from the actor’s film and television career.,The New York Times,2013-07-02T23:57:28+0000,multimedia,Movies,Movies,NA,Slideshow,nyt://slideshow/d8c04a4e-307a-5ca3-91cf-03ebeb8f08a9,0,nyt://slideshow/d8c04a4e-307a-5ca3-91cf-03ebeb8f08a9,Damon Winter/The New York Times,Michael Cera in Pictures,NA,NA,NA,NA,NA,NA,NA,NA,518,260,26,NA,NA
OK,Copyright (c) 2020 The New York Times Company. All Rights Reserved.,A trip this spring to Singapore yielded Karl Lagerfeld’s theme for his fall Chanel couture show.,https://www.nytimes.com/slideshow/2013/07/02/fashion/chanel_fall2013.html,A trip this spring to Singapore yielded Karl Lagerfeld’s theme for his fall Chanel couture show.,A trip this spring to Singapore yielded Karl Lagerfeld’s theme for his fall Chanel couture show.,The New York Times,2013-07-02T12:45:24+0000,multimedia,Fashion & Style,Fashion & Style,NA,Slideshow,nyt://slideshow/1358fa75-cf09-5f94-91dc-2b0a78c5192e,0,nyt://slideshow/1358fa75-cf09-5f94-91dc-2b0a78c5192e,Nowfashion.com,Chanel,NA,NA,NA,NA,NA,NA,NA,NA,518,260,26,NA,NA
OK,Copyright (c) 2020 The New York Times Company. All Rights Reserved.,"The president toured the prison cell where Nelson Mandela spent many years, and he spoke of the African leader’s legacy in a speech in Cape Town.",https://www.nytimes.com/slideshow/2013/07/01/world/africa/01safrica-ss.html,"The president toured the prison cell where Nelson Mandela spent many years, and he spoke of the African leader’s legacy in a speech in Cape Town.","The president toured the prison cell where Nelson Mandela spent many years, and he spoke of the African leader’s legacy in a speech in Cape Town.",The New York Times,2013-07-01T03:01:55+0000,multimedia,World,World,Africa,Slideshow,nyt://slideshow/9d97225b-6c16-589d-b27f-9dfa36922287,0,nyt://slideshow/9d97225b-6c16-589d-b27f-9dfa36922287,Bryan Denton for The New York Times,Obama Honors and Invokes Mandela’s Legacy,NA,NA,NA,NA,NA,NA,NA,NA,518,270,41,NA,NA
OK,Copyright (c) 2020 The New York Times Company. All Rights Reserved.,"Millions took to the streets across the country, seeking the ouster of President Mohamed Morsi.",https://www.nytimes.com/slideshow/2013/07/01/world/middleeast/01egypt-article.html,"Millions took to the streets across the country, seeking the ouster of President Mohamed Morsi.","Millions took to the streets across the country, seeking the ouster of President Mohamed Morsi.",The New York Times,2013-07-01T03:43:15+0000,multimedia,World,World,Middle East,Slideshow,nyt://slideshow/509a437a-70db-52dc-8d09-f1bfe3f56587,0,nyt://slideshow/509a437a-70db-52dc-8d09-f1bfe3f56587,Amr Abdallah Dalsh/Reuters,Demonstrations Grip Egypt,NA,NA,NA,NA,NA,NA,NA,NA,518,270,41,NA,NA
OK,Copyright (c) 2020 The New York Times Company. All Rights Reserved.,"Donald Bevan, who spent two years in war camps, was the third of only four caricaturists that Sardi’s has employed since 1927.",https://www.nytimes.com/slideshow/2013/07/01/arts/SUB-01-BEVAN-OBIT.html,"Donald Bevan, who spent two years in war camps, was the third of only four caricaturists that Sardi’s has employed since 1927.","Donald Bevan, who spent two years in war camps, was the third of only four caricaturists that Sardi’s has employed since 1927.",The New York Times,2013-07-01T06:29:28+0000,multimedia,Arts,Arts,NA,Slideshow,nyt://slideshow/7b27c19d-a135-553c-87ef-4583ada72f41,0,nyt://slideshow/7b27c19d-a135-553c-87ef-4583ada72f41,.,"Prisoner of War, Caricaturist and Playwright",NA,NA,NA,NA,NA,NA,NA,NA,518,270,41,NA,NA
OK,Copyright (c) 2020 The New York Times Company. All Rights Reserved.,"Looks from the red carpet at the B.E.T Awards, including Kendrick Lamar, Janelle Monae and Pharrell Williams.",https://www.nytimes.com/slideshow/2013/07/01/fashion/betawardsredcarpet.html,"Looks from the red carpet at the B.E.T Awards, including Kendrick Lamar, Janelle Monae and Pharrell Williams.","Looks from the red carpet at the B.E.T Awards, including Kendrick Lamar, Janelle Monae and Pharrell Williams.",The New York Times,2013-07-01T16:30:58+0000,multimedia,Fashion & Style,Fashion & Style,NA,Slideshow,nyt://slideshow/558ce146-0fa2-5f4d-b589-f5a0d8b217ae,0,nyt://slideshow/558ce146-0fa2-5f4d-b589-f5a0d8b217ae,Frederick M. Brown/Getty Images For Bet,B.E.T. Awards Red Carpet,NA,NA,NA,NA,NA,NA,NA,NA,518,270,41,NA,NA
OK,Copyright (c) 2020 The New York Times Company. All Rights Reserved.,The best of readers’ photos from the week of June 24.,https://www.nytimes.com/slideshow/2013/07/01/fashion/streetstyleshirtdresses.html,The best of readers’ photos from the week of June 24.,The best of readers’ photos from the week of June 24.,The New York Times,2013-07-01T17:45:20+0000,multimedia,Fashion & Style,Fashion & Style,NA,Slideshow,nyt://slideshow/1aa518f4-1e82-51a2-9c78-6814067645cc,0,nyt://slideshow/1aa518f4-1e82-51a2-9c78-6814067645cc,Violet Inseon Song,Street Style: Shirtdresses,NA,NA,NA,NA,NA,NA,NA,NA,518,270,41,NA,NA
OK,Copyright (c) 2020 The New York Times Company. All Rights Reserved.,The acclaimed short-story writer says she’s putting down her pen.,https://www.nytimes.com/slideshow/2013/07/01/books/20130702MUNRO.html,The acclaimed short-story writer says she’s putting down her pen.,The acclaimed short-story writer says she’s putting down her pen.,The New York Times,2013-07-01T21:20:44+0000,multimedia,Books,Books,NA,Slideshow,nyt://slideshow/dc138a5d-8dc4-50c1-b543-70af36cf28fa,0,nyt://slideshow/dc138a5d-8dc4-50c1-b543-70af36cf28fa,Ian Willms for The New York Times,Alice Munro Retires,NA,NA,NA,NA,NA,NA,NA,NA,518,270,41,NA,NA
OK,Copyright (c) 2020 The New York Times Company. All Rights Reserved.,"Gen. Abdul Fattah el-Sisi, the defense minister, said mass demonstrations over the weekend reflected an “unprecedented” expression of popular anger.",https://www.nytimes.com/slideshow/2013/07/01/world/middleeast/20130702-EGYPT.html,"Gen. Abdul Fattah el-Sisi, the defense minister, said mass demonstrations over the weekend reflected an “unprecedented” expression of popular anger.","Gen. Abdul Fattah el-Sisi, the defense minister, said mass demonstrations over the weekend reflected an “unprecedented” expression of popular anger.",The New York Times,2013-07-01T22:36:14+0000,multimedia,World,World,Middle East,Slideshow,nyt://slideshow/a93c14e9-3194-5656-bc0c-0381383a1cbc,0,nyt://slideshow/a93c14e9-3194-5656-bc0c-0381383a1cbc,Tara Todras-Whitehill for The New York Times,Egyptian Army Gives Morsi 48 Hours,NA,NA,NA,NA,NA,NA,NA,NA,518,270,41,NA,NA
OK,Copyright (c) 2020 The New York Times Company. All Rights Reserved.,President Mohamed Morsi was given 48 hours to respond to protesters or face a military takeover.,https://json8.nytimes.com/slideshow/2013/07/01/world/middleeast/egypt-s-army-issues-ultimatum-to-morsi.html,President Mohamed Morsi was given 48 hours to respond to protesters or face a military takeover.,President Mohamed Morsi was given 48 hours to respond to protesters or face a military takeover.,NA,2013-07-01T18:32:55+0000,multimedia,NA,NA,NA,Slideshow,nyt://slideshow/aa8f5eaa-d44a-5fe2-8651-76b928d3f7c7,0,nyt://slideshow/aa8f5eaa-d44a-5fe2-8651-76b928d3f7c7,NA,Egypt’s Army Issues Ultimatum to Morsi,NA,NA,NA,NA,NA,NA,NA,NA,518,270,41,NA,NA
OK,Copyright (c) 2020 The New York Times Company. All Rights Reserved.,A scene from Tarell Alvin McCraney’s new play at City Center Stage II.,https://www.nytimes.com/video/theater/100000002313655/excerpt-choir-boy.html,A scene from Tarell Alvin McCraney’s new play at City Center Stage II.,A scene from Tarell Alvin McCraney’s new play at City Center Stage II.,The New York Times,2013-07-02T18:10:14+0000,multimedia,Culture,Theater,NA,Video,nyt://video/886caa74-e03e-5f44-a721-99fff5178924,0,nyt://video/886caa74-e03e-5f44-a721-99fff5178924,NA,Excerpt: 'Choir Boy',NA,NA,NA,NA,NA,NA,Manhattan Theater Club,NA,518,270,41,NA,NA
OK,Copyright (c) 2020 The New York Times Company. All Rights Reserved.,"Scenes from Egypt's capital, where a deadly attack on the headquarters of the Muslim Brotherhood erupted early Monday.",https://www.nytimes.com/video/world/middleeast/100000002312882/protesters-swarm-cairo.html,"Scenes from Egypt's capital, where a deadly attack on the headquarters of the Muslim Brotherhood erupted early Monday.","Scenes from Egypt's capital, where a deadly attack on the headquarters of the Muslim Brotherhood erupted early Monday.",The New York Times,2013-07-01T14:55:06+0000,multimedia,,World,Middle East,Video,nyt://video/05d73e7f-2173-5dbe-9e32-1dc337876618,0,nyt://video/05d73e7f-2173-5dbe-9e32-1dc337876618,NA,Protesters Swarm Cairo,NA,NA,NA,NA,NA,NA,Alyssa Kim,NA,518,270,41,NA,NA
OK,Copyright (c) 2020 The New York Times Company. All Rights Reserved.,"Donald Bevan, who spent two years in war camps, was the third of only four caricaturists that Sardi’s has employed since 1927.",https://www.nytimes.com/slideshow/2013/07/01/arts/01-BEVAN-OBIT.html,"Donald Bevan, who spent two years in war camps, was the third of only four caricaturists that Sardi’s has employed since 1927.","Donald Bevan, who spent two years in war camps, was the third of only four caricaturists that Sardi’s has employed since 1927.",The New York Times,2013-07-01T02:57:22+0000,multimedia,Arts,Arts,NA,Slideshow,nyt://slideshow/2e1d80cd-18ff-580b-b7bd-72cd46cef528,0,nyt://slideshow/2e1d80cd-18ff-580b-b7bd-72cd46cef528,.,"Prisoner of War, Cartoonist and Playwright",NA,NA,NA,NA,NA,NA,NA,NA,518,280,27,NA,NA
OK,Copyright (c) 2020 The New York Times Company. All Rights Reserved.,"Candy Crush Saga is the latest mobile gaming craze, and it doesn’t seem to be slowing down.",https://bits.blogs.nytimes.com/2013/07/02/candy-crush-saga-is-this-summers-sweet-treat/,"Candy Crush Saga is the latest mobile gaming craze, and it doesn’t seem to be slowing down.","It’s hard to know what, exactly, is so addictive about Candy Crush Saga, a puzzle game that challenges players to get three or more matching types of candy in a row.",The New York Times,2013-07-02T22:37:19+0000,article,,Technology,NA,News,nyt://article/f099af98-efa8-5943-b735-bdc3b572b3ca,833,nyt://article/f099af98-efa8-5943-b735-bdc3b572b3ca,NA,Candy Crush Saga Is This Summer’s Sweet Treat,Bits,NA,Candy Crush Saga Is Summer Hit,NA,NA,NA,By Jenna Wortham,NA,518,280,27,B,5
OK,Copyright (c) 2020 The New York Times Company. All Rights Reserved.,Rowing isn’t all Thomas Eakins-oil-painted calm and aquatic recreation. And those aren’t boats out there; they’re torture devices.,https://6thfloor.blogs.nytimes.com/2013/07/01/an-oarsman-is-a-verb-meaning-to-row/,Rowing isn’t all Thomas Eakins-oil-painted calm and aquatic recreation. And those aren’t boats out there; they’re torture devices.,"The summer heat is finally here — makes you want to get out on the water and splash around with some oars, no? Especially when you see tranquil scenes like the cover of this book, how can you not get up for a little boating?",The New York Times,2013-07-01T19:13:10+0000,article,,Magazine,NA,News,nyt://article/e5d61cbd-fb1c-5887-8015-7ab9af248183,800,nyt://article/e5d61cbd-fb1c-5887-8015-7ab9af248183,NA,An Oarsman Is a Verb Meaning ‘to Row’,The 6th Floor,NA,NA,NA,NA,NA,By Dean Robinson,NA,518,280,27,NA,NA
OK,Copyright (c) 2020 The New York Times Company. All Rights Reserved.,Naomi Campbell walked the runway for Versace to kick off couture week in Paris.,https://runway.blogs.nytimes.com/2013/07/01/a-fashion-rock-star-returns/,Naomi Campbell walked the runway for Versace to kick off couture week in Paris.,"When Donatella Versace kicked off couture week here in Paris on Sunday night, in a typically opulent setting a few blocks from the Arc de Triomphe, she had a surprise for the audience (and not just the fact that the show began remarkably close to its scheduled 9 p.m. start).",The New York Times,2013-07-01T14:06:31+0000,article,,Style,NA,News,nyt://article/66ac5995-6ce3-5995-9539-c763b3f2deea,281,nyt://article/66ac5995-6ce3-5995-9539-c763b3f2deea,NA,A Fashion Rock Star Returns,On the Runway,NA,NA,NA,NA,NA,By Stuart Emmrich,NA,518,280,27,NA,NA
