status,copyright,response.docs.abstract,response.docs.web_url,response.docs.snippet,response.docs.lead_paragraph,response.docs.source,response.docs.pub_date,response.docs.document_type,response.docs.news_desk,response.docs.section_name,response.docs.subsection_name,response.docs.type_of_material,response.docs._id,response.docs.word_count,response.docs.uri,response.docs.slideshow_credits,response.docs.headline.main,response.docs.headline.kicker,response.docs.headline.content_kicker,response.docs.headline.print_headline,response.docs.headline.name,response.docs.headline.seo,response.docs.headline.sub,response.docs.byline.original,response.docs.byline.organization,response.meta.hits,response.meta.offset,response.meta.time,response.docs.print_section,response.docs.print_page
OK,Copyright (c) 2020 The New York Times Company. All Rights Reserved.,Amnesty International USA says the United States should embrace the human rights protections of the Leahy Law.,https://www.nytimes.com/2013/07/01/opinion/rights-and-the-military.html,Amnesty International USA says the United States should embrace the human rights protections of the Leahy Law.,To the Editor:,The New York Times,2013-07-01T01:23:07+0000,article,Letters,Opinion,NA,Letter,nyt://article/e9a07a50-5291-5893-b302-1ae360c6f0d8,157,nyt://article/e9a07a50-5291-5893-b302-1ae360c6f0d8,NA,Rights and the Military,Letter,NA,Rights and the Military,NA,NA,NA,NA,NA,518,370,31,A,22
OK,Copyright (c) 2020 The New York Times Company. All Rights Reserved.,A writer objects to bicycles’ being “singled out as a privileged mode of conveyance.” Readers are invited to respond.,https://www.nytimes.com/2013/07/01/opinion/invitation-to-a-dialogue-a-city-of-bike-clutter.html,A writer objects to bicycles’ being “singled out as a privileged mode of conveyance.” Readers are invited to respond., ,The New York Times,2013-07-01T00:11:40+0000,article,Letters,Opinion,NA,Letter,nyt://article/babccdf2-2f4d-53f2-97d5-f5de43233d68,205,nyt://article/babccdf2-2f4d-53f2-97d5-f5de43233d68,NA,Invitation to a Dialogue: A City of Bike Clutter,Letter,NA,Invitation to a Dialogue: A City of Bike Clutter,NA,NA,NA,NA,NA,518,380,44,A,22
OK,Copyright (c) 2020 The New York Times Company. All Rights Reserved.,"Rachel Moreno of Notre Dame writes that there is reason for hope, not despair.",https://www.nytimes.com/2013/07/01/opinion/future-of-catholic-schools.html,"Rachel Moreno of Notre Dame writes that there is reason for hope, not despair.",To the Editor: ,The New York Times,2013-07-01T01:23:07+0000,article,Letters,Opinion,NA,Letter,nyt://article/7a94246e-da14-5043-97df-02d15f3ade4c,210,nyt://article/7a94246e-da14-5043-97df-02d15f3ade4c,NA,Future of Catholic Schools,Letter,NA,Future of Catholic Schools,NA,NA,NA,NA,NA,518,380,44,NA,NA
OK,Copyright (c) 2020 The New York Times Company. All Rights Reserved.,"The winning numbers for July 1, 2013, for New York, New Jersey and Connecticut.",https://www.nytimes.com/2013/07/02/nyregion/lottery-numbers.html,"The winning numbers for July 1, 2013, for New York, New Jersey and Connecticut.","July 1, 2013",The New York Times,2013-07-02T01:28:03+0000,article,Metro,New York,NA,List,nyt://article/279e092e-c44b-525a-a315-8b23eb4796ef,178,nyt://article/279e092e-c44b-525a-a315-8b23eb4796ef,NA,Lottery Numbers,NA,NA,Lottery Numbers,NA,NA,NA,NA,NA,518,380,44,A,19
OK,Copyright (c) 2020 The New York Times Company. All Rights Reserved.,The founder of a medical technology company discusses the future of primary care practices.,https://www.nytimes.com/2013/07/02/opinion/helping-doctors-succeed.html,The founder of a medical technology company discusses the future of primary care practices.,To the Editor:,The New York Times,2013-07-02T01:23:08+0000,article,Letters,Opinion,NA,Letter,nyt://article/fe8b391d-2bce-52f0-8601-e04000facf68,206,nyt://article/fe8b391d-2bce-52f0-8601-e04000facf68,NA,Helping Doctors Succeed,Letter,NA,Helping Doctors Succeed,NA,NA,NA,NA,NA,518,380,44,NA,NA
OK,Copyright (c) 2020 The New York Times Company. All Rights Reserved.,A reader says let some of the city’s billionaires step up.,https://www.nytimes.com/2013/07/02/opinion/save-the-seaport-museum.html,A reader says let some of the city’s billionaires step up.,To the Editor:,The New York Times,2013-07-02T01:23:12+0000,article,Letters,Opinion,NA,Letter,nyt://article/1f0a7562-4f4f-5e06-a93c-4c61b2939891,139,nyt://article/1f0a7562-4f4f-5e06-a93c-4c61b2939891,NA,Save the Seaport Museum,Letter,NA,Save the Seaport Museum,NA,NA,NA,NA,NA,518,380,44,A,24
OK,Copyright (c) 2020 The New York Times Company. All Rights Reserved.,"The winning numbers for June 30, 2013, for New York, New Jersey and Connecticut.",https://www.nytimes.com/2013/07/01/nyregion/lottery-numbers.html,"The winning numbers for June 30, 2013, for New York, New Jersey and Connecticut.","June 30, 2013",The New York Times,2013-07-01T01:18:53+0000,article,Metro,New York,NA,List,nyt://article/a42a752a-d6de-55d8-a9b8-7c29b2082697,167,nyt://article/a42a752a-d6de-55d8-a9b8-7c29b2082697,NA,Lottery Numbers,NA,NA,Lottery Numbers,NA,NA,NA,NA,NA,518,380,44,A,24
OK,Copyright (c) 2020 The New York Times Company. All Rights Reserved.,"Bruce Feiler, author of “The Secrets of Happy Families,” gives his top five tips to improve your family vacation this summer.",https://www.nytimes.com/video/books/100000002251251/the-secrets-of-a-happy-family-vacation.html,"Bruce Feiler, author of “The Secrets of Happy Families,” gives his top five tips to improve your family vacation this summer.","Bruce Feiler, author of “The Secrets of Happy Families,” gives his top five tips to improve your family vacation this summer.",The New York Times,2013-07-02T17:46:53+0000,multimedia,Culture,Books,NA,Video,nyt://video/b1531422-1451-5440-aa61-4810b2a46afa,0,nyt://video/b1531422-1451-5440-aa61-4810b2a46afa,NA,The Secrets of a Happy Family Vacation,NA,NA,NA,NA,NA,NA,Poh Si Teng,NA,518,380,44,NA,NA
OK,Copyright (c) 2020 The New York Times Company. All Rights Reserved.,"Revel in the season with a pie (or a tart, or a cobbler). Here are 20 recipes to carry you through the warm months.",https://www.nytimes.com/interactive/2013/06/01/dining/pie-recipes-2013.html,"Revel in the season with a pie (or a tart, or a cobbler). Here are 20 recipes to carry you through the warm months.","Revel in the season with a pie (or a tart, or a cobbler). Here are 20 recipes to carry you through the warm months.",The New York Times,2013-07-01T18:08:49+0000,multimedia,Food,Food,NA,Interactive Feature,nyt://interactive/da948008-401d-5846-b99f-2bd21c23fec7,0,nyt://interactive/da948008-401d-5846-b99f-2bd21c23fec7,NA,Twenty Pies to Make This Summer,NA,NA,NA,NA,NA,NA,NA,NA,518,380,44,NA,NA
OK,Copyright (c) 2020 The New York Times Company. All Rights Reserved.,Banks in China frequently use trust companies as a means of making loans off the books.,https://www.nytimes.com/interactive/2013/07/02/business/Questionable-Lending-in-China.html,Banks in China frequently use trust companies as a means of making loans off the books.,Banks in China frequently use trust companies as a means of making loans off the books.,The New York Times,2013-07-01T23:29:52+0000,multimedia,Business Day,Business Day,NA,Interactive Feature,nyt://interactive/6ebe7380-3368-5555-90a0-b798df42e82d,0,nyt://interactive/6ebe7380-3368-5555-90a0-b798df42e82d,NA,Questionable Lending in China,NA,NA,NA,NA,NA,NA,NA,NA,518,380,44,NA,NA
OK,Copyright (c) 2020 The New York Times Company. All Rights Reserved.,"Tulsa’s boosters argue that the city, seeking to host the 2024 Olympics, offers something that big-ticket rivals can only dream of — the vast frontier of America.",https://www.nytimes.com/slideshow/2013/07/01/sports/olympics/Tulsa2024.html,"Tulsa’s boosters argue that the city, seeking to host the 2024 Olympics, offers something that big-ticket rivals can only dream of — the vast frontier of America.","Tulsa’s boosters argue that the city, seeking to host the 2024 Olympics, offers something that big-ticket rivals can only dream of — the vast frontier of America.",The New York Times,2013-07-01T02:25:21+0000,multimedia,Sports,Sports,Olympics,Slideshow,nyt://slideshow/f891df3c-0fd9-54d9-ab7e-9ccb24c78736,0,nyt://slideshow/f891df3c-0fd9-54d9-ab7e-9ccb24c78736,Christopher Smith for The New York Times,A Midsize City With a Global Ambition,NA,NA,NA,NA,NA,NA,NA,NA,518,380,44,NA,NA
OK,Copyright (c) 2020 The New York Times Company. All Rights Reserved.,Members of the Granite Mountain Hotshots died in the fast-moving blaze near Yarnell.,https://json8.nytimes.com/slideshow/2013/07/01/us/wildfire-kills-19-firefighters-in-arizona.html,Members of the Granite Mountain Hotshots died in the fast-moving blaze near Yarnell.,Members of the Granite Mountain Hotshots died in the fast-moving blaze near Yarnell.,NA,2013-07-01T18:14:19+0000,multimedia,NA,NA,NA,Slideshow,nyt://slideshow/5903abde-cec9-59f7-b72f-2acfadc4ed9f,0,nyt://slideshow/5903abde-cec9-59f7-b72f-2acfadc4ed9f,NA,Wildfire Kills 19 Firefighters in Arizona,NA,NA,NA,NA,NA,NA,NA,NA,518,390,26,NA,NA
OK,Copyright (c) 2020 The New York Times Company. All Rights Reserved.,Paris,https://www.nytimes.com/slideshow/2013/07/02/fashion/runway-couture/chanel-fall-2013-couture.html,Paris,Paris,The New York Times,2013-07-02T12:04:44+0000,multimedia,Fashion & Style,Fashion & Style,Couture Runway,Slideshow,nyt://slideshow/9ac29d90-7976-5ae1-b264-42987d1cefe3,0,nyt://slideshow/9ac29d90-7976-5ae1-b264-42987d1cefe3,Nowfashion.com,Chanel: Fall 2013 Couture,NA,NA,NA,NA,NA,NA,NA,NA,518,390,26,NA,NA
OK,Copyright (c) 2020 The New York Times Company. All Rights Reserved.,Paris,https://www.nytimes.com/slideshow/2013/07/01/fashion/runway-couture/christian-dior-fall-2013-couture.html,Paris,Paris,The New York Times,2013-07-02T12:08:40+0000,multimedia,Fashion & Style,Fashion & Style,Couture Runway,Slideshow,nyt://slideshow/9f2d6c22-c08a-50a3-a555-ecddcfa1a921,0,nyt://slideshow/9f2d6c22-c08a-50a3-a555-ecddcfa1a921,Nowfashion.com,Christian Dior: Fall 2013 Couture,NA,NA,NA,NA,NA,NA,NA,NA,518,390,26,NA,NA
OK,Copyright (c) 2020 The New York Times Company. All Rights Reserved.,Paris,https://www.nytimes.com/slideshow/2013/07/02/fashion/runway-couture/ulyana-sergeenko-fall-2013-couture.html,Paris,Paris,The New York Times,2013-07-02T13:56:13+0000,multimedia,Fashion & Style,Fashion & Style,Couture Runway,Slideshow,nyt://slideshow/f131c8cc-d83c-5fff-92f1-21962b2ba47d,0,nyt://slideshow/f131c8cc-d83c-5fff-92f1-21962b2ba47d,Nowfashion.com,Ulyana Sergeenko: Fall 2013 Couture,NA,NA,NA,NA,NA,NA,NA,NA,518,390,26,NA,NA
OK,Copyright (c) 2020 The New York Times Company. All Rights Reserved.,"Giambattista Valli’s fall haute couture collection was based some of his garland-embroidered dresses and sweet dresses on Sèvres, Meissen and Wedgwood plates, among others in the cupboard.",https://www.nytimes.com/slideshow/2013/07/01/fashion/valli-spring14.html,"Giambattista Valli’s fall haute couture collection was based some of his garland-embroidered dresses and sweet dresses on Sèvres, Meissen and Wedgwood plates, among others in the cupboard.","Giambattista Valli’s fall haute couture collection was based some of his garland-embroidered dresses and sweet dresses on Sèvres, Meissen and Wedgwood plates, among others in the cupboard.",The New York Times,2013-07-01T20:43:38+0000,multimedia,Fashion & Style,Fashion & Style,NA,Slideshow,nyt://slideshow/10372307-7616-5284-8331-3f85b7e6b274,0,nyt://slideshow/10372307-7616-5284-8331-3f85b7e6b274,Nowfashion.com,Giambattista Valli,NA,NA,NA,NA,NA,NA,NA,NA,518,390,26,NA,NA
OK,Copyright (c) 2020 The New York Times Company. All Rights Reserved.,Couture,https://www.nytimes.com/slideshow/2013/07/02/fashion/sergeenko_fall2013.html,Couture,Couture,The New York Times,2013-07-02T13:53:46+0000,multimedia,Fashion & Style,Fashion & Style,NA,Slideshow,nyt://slideshow/a352bf2e-92ee-5985-a59d-1b8ea4b21cda,0,nyt://slideshow/a352bf2e-92ee-5985-a59d-1b8ea4b21cda,Nowfashion.com,Ulyana Sergeenko,NA,NA,NA,NA,NA,NA,NA,NA,518,390,26,NA,NA
OK,Copyright (c) 2020 The New York Times Company. All Rights Reserved.,"The Times’s Kim Severson visits Mount Airy, N.C., to learn more about the sonker, a soupy baked fruit dessert native to Surry County.",https://www.nytimes.com/video/dining/100000002309461/mayberrys-sonker.html,"The Times’s Kim Severson visits Mount Airy, N.C., to learn more about the sonker, a soupy baked fruit dessert native to Surry County.","The Times’s Kim Severson visits Mount Airy, N.C., to learn more about the sonker, a soupy baked fruit dessert native to Surry County.",The New York Times,2013-07-01T18:23:18+0000,multimedia,Dining,Food,NA,Video,nyt://video/3f8e2285-173c-53e9-af4b-78c3ab3c002b,0,nyt://video/3f8e2285-173c-53e9-af4b-78c3ab3c002b,NA,Forget Pie or Cobbler: Call It a Sonker,NA,NA,NA,NA,NA,NA,Raymond McCrea Jones,NA,518,390,26,NA,NA
OK,Copyright (c) 2020 The New York Times Company. All Rights Reserved.,"Thousands marched along Istanbul's most popular pedestrian walkway on Sunday, demanding better treatment and equal rights for lesbian, gay, bisexual and transgender individuals and communities.",https://www.nytimes.com/video/multimedia/100000002311710/protests-for-gay-rights-in-turkey.html,"Thousands marched along Istanbul's most popular pedestrian walkway on Sunday, demanding better treatment and equal rights for lesbian, gay, bisexual and transgender individuals and communities.","Thousands marched along Istanbul's most popular pedestrian walkway on Sunday, demanding better treatment and equal rights for lesbian, gay, bisexual and transgender individuals and communities.",The New York Times,2013-07-01T01:25:02+0000,multimedia,,Multimedia/Photos,NA,Video,nyt://video/69074a20-b7c6-5d1d-892b-df99af2629de,0,nyt://video/69074a20-b7c6-5d1d-892b-df99af2629de,NA,Protests for Gay Rights in Turkey,NA,NA,NA,NA,NA,NA,Sebnem Arsu,NA,518,390,26,NA,NA
OK,Copyright (c) 2020 The New York Times Company. All Rights Reserved.,China’s slowing economy is challenging the government to enact reforms without exacerbating the problem.,https://www.nytimes.com/video/business/100000002314577/chinas-financial-bind.html,China’s slowing economy is challenging the government to enact reforms without exacerbating the problem.,China’s slowing economy is challenging the government to enact reforms without exacerbating the problem.,The New York Times,2013-07-02T01:33:25+0000,multimedia,Business,Business Day,NA,Video,nyt://video/e838ecba-ada3-5f2a-a4b6-ac5da0572b13,0,nyt://video/e838ecba-ada3-5f2a-a4b6-ac5da0572b13,NA,China’s Financial Bind,NA,NA,NA,NA,NA,NA,"Ben Werschkul, Emma Cott and David Gillen",NA,518,390,26,NA,NA
OK,Copyright (c) 2020 The New York Times Company. All Rights Reserved.,Why were there so few sightings of the much-awaited insects in New York City?,https://www.nytimes.com/video/nyregion/100000002311653/in-search-of-the-cicadas.html,Why were there so few sightings of the much-awaited insects in New York City?,Why were there so few sightings of the much-awaited insects in New York City?,The New York Times,2013-07-01T01:29:43+0000,multimedia,Metro,New York,NA,Video,nyt://video/18cec609-6e22-5336-bd2d-0af1abd5b108,0,nyt://video/18cec609-6e22-5336-bd2d-0af1abd5b108,NA,In Search of the Cicadas,NA,NA,NA,NA,NA,NA,Samuel Orr,NA,518,390,26,NA,NA
OK,Copyright (c) 2020 The New York Times Company. All Rights Reserved.,Egypt and More — Pictures of the Day,https://json8.nytimes.com/slideshow/2013/07/02/blogs/pictures-of-the-day-egypt-and-elsewhere.html,Egypt and More — Pictures of the Day,Egypt and More — Pictures of the Day,NA,2013-07-02T20:33:11+0000,multimedia,NA,NA,NA,Slideshow,nyt://slideshow/ab0bc96c-de70-5dee-8fc5-a5b1d2e22b98,0,nyt://slideshow/ab0bc96c-de70-5dee-8fc5-a5b1d2e22b98,NA,Pictures of the Day: Egypt and Elsewhere,NA,NA,NA,NA,NA,NA,NA,NA,518,400,54,NA,NA
OK,Copyright (c) 2020 The New York Times Company. All Rights Reserved.,"Jana Romanova traveled to Georgia to reconnect with long-lost relatives, and along the way, she turned the very concept of “relative” on its head.",https://json8.nytimes.com/slideshow/2013/07/02/blogs/from-russia-to-georgia-a-lesson-in-relativity.html,"Jana Romanova traveled to Georgia to reconnect with long-lost relatives, and along the way, she turned the very concept of “relative” on its head.","Jana Romanova traveled to Georgia to reconnect with long-lost relatives, and along the way, she turned the very concept of “relative” on its head.",NA,2013-07-02T22:31:20+0000,multimedia,NA,NA,NA,Slideshow,nyt://slideshow/307a8ec0-7c4e-534d-bef4-9ae3529801af,0,nyt://slideshow/307a8ec0-7c4e-534d-bef4-9ae3529801af,NA,"From Russia to Georgia, a Lesson in Relativity",NA,NA,NA,NA,NA,NA,NA,NA,518,400,54,NA,NA
OK,Copyright (c) 2020 The New York Times Company. All Rights Reserved.,,https://cooking.nytimes.com/recipes/1014839-pizza-on-the-grill-with-cherry-tomatoes-mozzarella-and-arugula,,"These grilled pizzas require no precooked sauce, though you could use some if you wanted to. The cherry tomatoes warm up but don’t collapse as they would in a hot oven. The arugula is sprinkled on when the pies come off the grill.<br/><br/>",NA,2013-07-02T00:00:00+0000,recipe,,NA,NA,Recipe,nyt://recipe/95e19cb2-5470-5a03-8432-a23f9b2d10f1,0,nyt://recipe/95e19cb2-5470-5a03-8432-a23f9b2d10f1,NA,"Pizza on the Grill With Cherry Tomatoes, Mozzarella and Arugula",NA,NA,NA,"Pizza on the Grill With Cherry Tomatoes, Mozzarella and Arugula",NA,NA,Martha Rose Shulman,NA,518,400,54,NA,NA
OK,Copyright (c) 2020 The New York Times Company. All Rights Reserved.,"The Ecorox Bluetooth is a small, rugged waterproof speaker that has simple controls and produces a pleasing mono sound,",https://gadgetwise.blogs.nytimes.com/2013/07/01/a-speaker-made-to-take-a-dunking/,"The Ecorox Bluetooth is a small, rugged waterproof speaker that has simple controls and produces a pleasing mono sound,","The Ecorox Bluetooth speaker is poised to make a splash. After all, it’s waterproof.",The New York Times,2013-07-01T12:17:42+0000,article,,Technology,Personal Tech,News,nyt://article/6e462078-ea02-5e5f-9d4d-05c7c919b0d0,256,nyt://article/6e462078-ea02-5e5f-9d4d-05c7c919b0d0,NA,A Speaker Made to Take a Dunking,Gadgetwise,NA,A Speaker for the Great and Wet Outdoors,NA,NA,NA,By Roy Furchgott,NA,518,400,54,B,8
OK,Copyright (c) 2020 The New York Times Company. All Rights Reserved.,The private equity-backed education company has filed for Chapter 11 bankruptcy protection as part of an effort to shrink its $5.8 billion debt load.,https://dealbook.nytimes.com/2013/07/02/cengage-learning-files-for-bankruptcy/,The private equity-backed education company has filed for Chapter 11 bankruptcy protection as part of an effort to shrink its $5.8 billion debt load.,"Chalk it up to a learning experience: too much debt, even in a low interest rate environment, can be costly. ",The New York Times,2013-07-02T18:41:53+0000,article,,Business Day,NA,News,nyt://article/33a9b483-9557-5bc1-a906-ee30881b8dd3,303,nyt://article/33a9b483-9557-5bc1-a906-ee30881b8dd3,NA,Cengage Learning Files for Bankruptcy,DealBook,NA,NA,NA,NA,NA,By Dealbook,NA,518,400,54,NA,NA
OK,Copyright (c) 2020 The New York Times Company. All Rights Reserved.,A proposal by Cameron and Tyler Winklevoss to create an exchange-traded fund dealing in bitcoins could make the digital currency more accessible to ordinary investors.,https://dealbook.nytimes.com/2013/07/01/first-name-in-the-first-fund-for-bitcoins-winklevoss/,A proposal by Cameron and Tyler Winklevoss to create an exchange-traded fund dealing in bitcoins could make the digital currency more accessible to ordinary investors.,"Bitcoin has been promoted as an alternative crypto-currency that exists outside the realms of governments and central banks. Now, two backers of the digital money are seeking to bring bitcoin into the investing mainstream — if they win the approval of the United States government.",The New York Times,2013-07-02T00:53:47+0000,article,,Business Day,NA,News,nyt://article/72cda7d3-4f15-5c02-9108-3373626c8d69,1054,nyt://article/72cda7d3-4f15-5c02-9108-3373626c8d69,NA,Winklevoss Twins Plan First Fund for Bitcoins,DealBook,NA,Winklevoss Twins Plan First Fund For Bitcoins,NA,NA,NA,By Nathaniel Popper and Peter Lattman,NA,518,400,54,B,1
OK,Copyright (c) 2020 The New York Times Company. All Rights Reserved.,"Video of the fast-moving fire in Arizona that killed 19 firefighters, most of them members of an elite team known as the Granite Mountain Hotshots.",https://thelede.blogs.nytimes.com/2013/07/01/video-of-arizona-wildfire-that-killed-19-firefighters/,"Video of the fast-moving fire in Arizona that killed 19 firefighters, most of them members of an elite team known as the Granite Mountain Hotshots.","Last Updated, 6:42 p.m. As my colleague Fernanda Santos reported, 19 firefighters died on Sunday while battling a fast-moving wildfire that continued to rage out of control on Monday over thousands of acres about 90 miles northwest of Phoenix. ",The New York Times,2013-07-01T13:19:37+0000,article,,Blogs,NA,News,nyt://article/7eb27771-ac66-5fa4-b3dd-64b88a9d8d80,672,nyt://article/7eb27771-ac66-5fa4-b3dd-64b88a9d8d80,NA,Fallen Firefighters Had Prepared for Worst-Case Scenario,The Lede,NA,NA,NA,NA,NA,By Jennifer Preston,NA,518,400,54,NA,NA
OK,Copyright (c) 2020 The New York Times Company. All Rights Reserved.,"Andrew Mason, former chief executive of Groupon, is trying on a new role as a motivational singer, with an album of seven songs about business.",https://dealbook.nytimes.com/2013/07/02/its-a-catchy-tune-but-can-you-manage-to-it/,"Andrew Mason, former chief executive of Groupon, is trying on a new role as a motivational singer, with an album of seven songs about business.",Some former corporate chieftains spend their post-executive days playing golf or attending board meetings outside the public view.,The New York Times,2013-07-02T14:46:32+0000,article,,Business Day,NA,News,nyt://article/d7492908-1c9b-55b5-a328-b23e7b62cf3e,455,nyt://article/d7492908-1c9b-55b5-a328-b23e7b62cf3e,NA,"It’s a Catchy Tune, but Can You Manage to It?",DealBook,NA,NA,NA,NA,NA,By William Alden,NA,518,400,54,NA,NA
OK,Copyright (c) 2020 The New York Times Company. All Rights Reserved.,"In the wake of the hoopla over the proposed Winklevoss exchange traded fund in bitcoins, the author offers a modest proposal.",https://dealbook.nytimes.com/2013/07/02/an-e-t-f-too-far/,"In the wake of the hoopla over the proposed Winklevoss exchange traded fund in bitcoins, the author offers a modest proposal.","Exchange-traded funds are taking over the financial world. At last official count, there were nearly 1,200 of them at the end of 2012, compared with about 100 a decade ago, according to the Investment Company Institute trade group. With a new issue now linking to the virtual currency Bitcoin, the $1.3 trillion index tracker industry seems to cover nearly everything. And yet the most important asset class of all has been ignored. Breakingviews stands ready to remedy the situation.",The New York Times,2013-07-02T15:48:12+0000,article,,Business Day,NA,News,nyt://article/32b86430-5a7f-5c27-88c3-0c1ba0c1df8c,367,nyt://article/32b86430-5a7f-5c27-88c3-0c1ba0c1df8c,NA,An E.T.F. Too Far,DealBook,NA,NA,NA,NA,NA,By Peter Thal Larsen,NA,518,400,54,NA,NA
OK,Copyright (c) 2020 The New York Times Company. All Rights Reserved.,"We’re on vacation this week, but here are 10 ways to celebrate, and learn from, the pleasures of the season.",https://learning.blogs.nytimes.com/2013/07/01/celebrate-summer-2013-ways-to-teach-the-season/,"We’re on vacation this week, but here are 10 ways to celebrate, and learn from, the pleasures of the season.","The Learning Network is taking a break this week in favor of July joys like fireworks, ice cream and blockbuster movies, and we hope you are, too.",The New York Times,2013-07-01T09:07:29+0000,article,,Education,NA,News,nyt://article/e248d459-bb13-5b12-919e-5c6dd0258b03,1355,nyt://article/e248d459-bb13-5b12-919e-5c6dd0258b03,NA,Celebrate Summer 2013: Ways to Teach the Season,The Learning Network,NA,NA,NA,NA,NA,By Katherine Schulten,NA,518,400,54,NA,NA
OK,Copyright (c) 2020 The New York Times Company. All Rights Reserved.,"Federal unemployment insurance benefit programs have been pared back over the last year and a half, and are now undergoing major cuts as a result of the budget cuts known as the sequester.",https://economix.blogs.nytimes.com/2013/07/02/sequester-hits-the-long-term-unemployed/,"Federal unemployment insurance benefit programs have been pared back over the last year and a half, and are now undergoing major cuts as a result of the budget cuts known as the sequester.","Sunday was the five-year anniversary of the Emergency Unemployment Compensation program, a federal program signed into law by President George W. Bush that initially added 13 weeks of unemployment benefits to the standard 26 weeks states already offered eligible jobless workers. The 13 additional weeks of benefits were intended to be temporary, but as the recession worsened, Congress decided to keep the program going and even lengthened the amount of time that workers could receive benefits. For a while workers could receive as many as 99 weeks in some states, the longest duration of jobless benefits on record.",The New York Times,2013-07-02T14:00:29+0000,article,,Business Day,Economy,News,nyt://article/51c09be6-284f-5cd0-978a-668e7847f48b,621,nyt://article/51c09be6-284f-5cd0-978a-668e7847f48b,NA,Sequester Hits the Long-Term Unemployed,Economix,NA,NA,NA,NA,NA,By Catherine Rampell,NA,518,410,53,NA,NA
